Type,Title,Link
Papers,2-year-olds use syntax to infer actor intentions in a rational-action paradigm,https://escholarship.org/uc/item/0f53h1v3
Papers,"Scene Inversion Slows the Rejection of False Positives through Saccade Exploration
During Search",https://escholarship.org/uc/item/1g83m1xn
Papers,Expertise in Cognitive Task Analysis Interviews,https://escholarship.org/uc/item/2vh8x287
Papers,"On the interplay between spontaneous spoken instructions and human visual
behaviour in an indoor guidance task",https://escholarship.org/uc/item/81v3r1p2
Papers,"Investigating Ways of Interpretations of Artificial Subtle Expressions
Among Different Languages: A Case of Comparison Among Japanese, German,
Portuguese and Mandarin Chinese",https://escholarship.org/uc/item/6t81n3r5
Papers,The better part of not knowing: Virtuous ignorance,https://escholarship.org/uc/item/8232v65n
Papers,Hierarchical Reasoning with Distributed Vector Representations,https://escholarship.org/uc/item/47s3m5h0
Papers,"Exploring Complexity in Decisions from Experience: Same Minds, Same Strategy",https://escholarship.org/uc/item/05x063f2
Papers,"Language and Gesture Descriptions Affect Memory:
A Nonverbal Overshadowing Effect",https://escholarship.org/uc/item/23k932nb
Papers,"Can You Repeat That?
The Effect of Item Repetition on Interleaved and Blocked Study",https://escholarship.org/uc/item/864370qv
Papers,Can Modern Neuroscience Change Our Idea of the Human?,https://escholarship.org/uc/item/99r800z9
Papers,Emergent Collective Sensing in Human Groups,https://escholarship.org/uc/item/0c03h134
Papers,Semantically underinformative utterances trigger pragmatic inferences,https://escholarship.org/uc/item/3f48n0tr
Papers,"Animation Facilitates Source Understanding
and Spontaneous Analogical Transfer",https://escholarship.org/uc/item/8hx4g6qg
Papers,A diffusion model account of the transfer-of-training effect,https://escholarship.org/uc/item/49z012s9
Papers,Computational evolution of decision-making strategies,https://escholarship.org/uc/item/4421031m
Papers,The fan effect in overlapping data sets and logical inference,https://escholarship.org/uc/item/2xk4r8cs
Papers,The learnability of Auditory Center-embedded Recursion,https://escholarship.org/uc/item/7kc5w5xm
Papers,Deep Neural Networks Predict Category Typicality Ratings for Images,https://escholarship.org/uc/item/4mv9c98f
Papers,"More than true: Developmental changes in use of the inductive strength
for selective trust",https://escholarship.org/uc/item/0mb9s75q
Papers,Assessing Claims of Metaphorical Salience Through Corpus Data,https://escholarship.org/uc/item/5bb08168
Papers,"Semantic Alignment of Fractions and Decimals with Discrete
Versus Continuous Entities: A Cross-national Comparison",https://escholarship.org/uc/item/9ks2d0mv
Papers,The Roles of Knowledge and Memory in Generating Top-10 Lists,https://escholarship.org/uc/item/4zg2q8tf
Papers,"Convincing people of the Monty Hall Dilemma answer:
The impact of solution type and individual differences",https://escholarship.org/uc/item/2gq1h108
Papers,Independent Recognition of Numerosity Requires Attention,https://escholarship.org/uc/item/4t81484s
Papers,Measuring Time Gestures with the Microsoft Kinect,https://escholarship.org/uc/item/8gc886gt
Papers,If at First You Don't Succeed: The Role of Evidence in Preschoolers' and Infants' Persistence.,https://escholarship.org/uc/item/79v75857
Papers,"VisualWorking Memory as Decision Making:
Compensation for Memory Uncertainty in Reach Planning",https://escholarship.org/uc/item/72v9s1v8
Papers,"The reliability of testimony and perception: connecting epistemology and
linguistic evidentiality",https://escholarship.org/uc/item/59w6z399
Papers,Linguistic input overrides conceptual biases: When goals don't matter,https://escholarship.org/uc/item/3hj493bj
Papers,"Word order in a grammarless language: A ‚Äòsmall-data‚Äô information-theoretic
approach",https://escholarship.org/uc/item/1x10c3nj
Papers,Constructional paradigms affect visual lexical decision latencies in English,https://escholarship.org/uc/item/1th0w6t8
Papers,"The Smell of Jazz: Crossmodal Correspondences Between Music, Odor, and
Emotion",https://escholarship.org/uc/item/1hb8c91r
Papers,Structured priors in visual working memory revealed through iterated learning,https://escholarship.org/uc/item/8p7887dz
Papers,Conceptual complexity and the evolution of the lexicon,https://escholarship.org/uc/item/0s20w8hz
Papers,"Music Reading Expertise Modulates Hemispheric Lateralization in
English Word Processing but not in Chinese Character Processing",https://escholarship.org/uc/item/5w475574
Papers,Constraints on Learning Non-Adjacent Dependencies (NADs) of Visual Stimuli,https://escholarship.org/uc/item/1b75k23m
Papers,Evaluating Human Cognition of Containing Relations with Physical Simulation,https://escholarship.org/uc/item/1c03t43q
Papers,When to use which heuristic: A rational solution to the strategy selection problem,https://escholarship.org/uc/item/9497r96p
Papers,Children and adults differ in their strategies for social learning,https://escholarship.org/uc/item/7pj7q12z
Papers,"The Exemplar Confusion Model:
An Account of Biased Probability Estimates in Decisions from Description",https://escholarship.org/uc/item/2qp20480
Papers,"Stepping up to the Blackboard: Distributed Cognition in Doctor-Patient
Interactions",https://escholarship.org/uc/item/4wd8d2rf
Papers,Creating a New Communication System: Gesture has the Upper Hand,https://escholarship.org/uc/item/8q78w6j0
Papers,Linguistic Modality Affects the Creation of Structure and Iconicity in Signals,https://escholarship.org/uc/item/84q5m77d
Papers,"Can experience with different types of writing system modulate holistic processing
in speech perception?",https://escholarship.org/uc/item/5kn385gp
Papers,"Symbolic Integration, Not Symbolic Estrangement, For Double-Digit Numbers",https://escholarship.org/uc/item/44b8c8vw
Papers,Action-Oriented Representations in the Motor Control,https://escholarship.org/uc/item/2bd4p68m
Papers,Tracking Relations: The Effects of Visual Attention on Relational Recognition,https://escholarship.org/uc/item/6mm5d5t3
Papers,Piece of Mind: Long-Term Memory Structure in ACT-R and CHREST,https://escholarship.org/uc/item/6105r91v
Papers,Time after Time in Words: Chronology through Language Statistics,https://escholarship.org/uc/item/9q53z0md
Papers,"Partitioning the Firing Patterns of Spike Trains by
Community Modularity",https://escholarship.org/uc/item/0v86d6c8
Papers,"Exploring the Concept of Utility: Are Separate Value Functions required for Risky
and Inter-temporal Choice?",https://escholarship.org/uc/item/00x4w0rm
Papers,"Response Time Variability in an Inhibitory Control Task Reflects Statistical
Learning and Adaptive Decision-Making",https://escholarship.org/uc/item/1qt4p6fz
Papers,"Referential cues modulate attention and memory
during cross-situational word learning",https://escholarship.org/uc/item/5rx7w4kb
Papers,Memory Strategically Encodes Externally Unavailable Information,https://escholarship.org/uc/item/8545d92j
Papers,"Evaluating contingencies by a dual system of learning the structure and the
parameters of the environment",https://escholarship.org/uc/item/6cz7j27b
Papers,Modelling Political Source Credibility of Election Candidates in the USA,https://escholarship.org/uc/item/4pk1c6pv
Papers,Investigation on Using 3D Printed Liver during Surgery,https://escholarship.org/uc/item/8n162459
Papers,Quit while you're ahead: Preschoolers' persistence and willingness to accept challenges are affected by social comparison,https://escholarship.org/uc/item/7g86b04m
Papers,"Ignorance-Based Chance Discovery
Beyond Dark Events",https://escholarship.org/uc/item/1wp2h0hv
Papers,Universals on Natural Language Determiners from a PAC-learnability Perspective,https://escholarship.org/uc/item/9zm4b6t5
Papers,Explaining the Number Hierarchy,https://escholarship.org/uc/item/5917s4b8
Papers,The mental number-line spreads by gestural contagion,https://escholarship.org/uc/item/75q3g0s4
Papers,"Modeling choice and search in decisions from experience: A sequential sampling
approach",https://escholarship.org/uc/item/7qr6z93q
Papers,"Both Symbolic and Embodied Representations Contribute to Spatial Language
Processing; Evidence from Younger and Older Adults",https://escholarship.org/uc/item/1dx2d4wn
Papers,Intellectualism and Psychology,https://escholarship.org/uc/item/7vc453gv
Papers,Naïve Beliefs About Intervening on Causes and Symptoms in the Health Domain,https://escholarship.org/uc/item/3zr9s8m7
Papers,"Priming bicultural bilingual Latino-Americans as Latino or American modulates
access to the Spanish and English meaning of interlingual homographs",https://escholarship.org/uc/item/5d09c0kc
Papers,"Illusory inferences: disjunctions, indefinites, and the erotetic theory of reasoning",https://escholarship.org/uc/item/1ft528sw
Papers,"Distributional determinants of learning argument structure constructions
in first and second language",https://escholarship.org/uc/item/2dz3n8kv
Papers,Individual Differences in Chunking Ability Predict On-line Sentence Processing,https://escholarship.org/uc/item/3v46m31n
Papers,"During category learning, top-down and bottom-up processes
battle for control of the eyes",https://escholarship.org/uc/item/2r73w3f6
Papers,Sound to Meaning Mappings in the Bouba-Kiki Effect,https://escholarship.org/uc/item/3s632891
Papers,An Integrated Account of Explanation and Question Answering,https://escholarship.org/uc/item/00f569fw
Papers,Reasoning About Diverse Evidence in Preference Predictions,https://escholarship.org/uc/item/1s734738
Papers,A Bayesian Framework for LearningWords From Multiword Utterances,https://escholarship.org/uc/item/0wk7n803
Papers,"A latent-mixture quantum probability model of causal reasoning within a Bayesian
inference framework",https://escholarship.org/uc/item/6431d4vd
Papers,"Reconstructing the Bayesian Adaptive Toolbox: Challenges of a dynamic
environment and partial information acquisition",https://escholarship.org/uc/item/34m2d2n6
Papers,The Role of Outcome Divergence in Goal-Directed Choice,https://escholarship.org/uc/item/2pw4g8p8
Papers,Towards semantically rich and recursive word learning models,https://escholarship.org/uc/item/7mk082t2
Papers,The perceptual foundation of linguistic context,https://escholarship.org/uc/item/464856tb
Papers,Personal Change and the Continuity of Identity,https://escholarship.org/uc/item/5j19n8kg
Papers,An ACT-R Model of the Choose-Short Effect in Time and Length,https://escholarship.org/uc/item/9674b6nk
Papers,The Antecedents of Moments of Learning,https://escholarship.org/uc/item/4pn4t2f3
Papers,Cognitive Factors and Representation Strategies in Sketching Math Diagrams,https://escholarship.org/uc/item/6xh496h9
Papers,What the Baldwin Effect affects,https://escholarship.org/uc/item/9hg7m32w
Papers,"Modeling idiosyncratic preferences: How generative knowledge and expression
frequency jointly determine language structure",https://escholarship.org/uc/item/7rm1r6jh
Papers,"Syntactic Alignment is an Index of A?ective Alignment:
An Information-Theoretical Study of Natural Dialogue",https://escholarship.org/uc/item/80h571x9
Papers,Does the Frequency of Pedagogical Agent Intervention Relate to Learners' Self- Reported Boredom while using Multiagent Intelligent Tutoring Systems?,https://escholarship.org/uc/item/9z7170zz
Papers,A Non-monotonic Extension of Universal Moral Grammar Theory,https://escholarship.org/uc/item/7ds2w3mm
Papers,"The Effect of Facial Emotion and Action Depiction on Situated Language
Processing",https://escholarship.org/uc/item/5j6095zk
Papers,"Beyond Magnitude:
How Math Expertise Guides Number Representation",https://escholarship.org/uc/item/8w25312d
Papers,"Influence of Excitation/Inhibition Imbalance on Local Processing Bias in
Autism Spectrum Disorder",https://escholarship.org/uc/item/0tj1p2gb
Papers,"Mediators or Alternative Explanations:
Transitivity in Human-Mediated Causal Chains",https://escholarship.org/uc/item/2mf7m8wh
Papers,"Effect is sure, but explanation is unsure:
Closer investigation of the foreign language effect with Japanese participants",https://escholarship.org/uc/item/2ft6673h
Papers,"Investigating Strategy Discovery and Coordination in a Novel Virtual Sheep
Herding Game among Dyads",https://escholarship.org/uc/item/7bn4m5nw
Papers,The Cognitive and Mathematical Profiles of Children in Early Elementary School,https://escholarship.org/uc/item/5n70n30t
Papers,"The Past and Future are in Your Hands:
How Gestures Affect Our Understanding of Temporal Concepts",https://escholarship.org/uc/item/2xn8263t
Papers,Children‚Äôs Trust in Technological and Human Informants,https://escholarship.org/uc/item/4rq1r8t6
Papers,"The SymbolicWorking Memory:
memory accommodations for schematic processing of symbolic information",https://escholarship.org/uc/item/7rn9h7b1
Papers,"Schematic Processing inWorking Memory Tasks
Relies on Learning and Long-Term Memory Resources",https://escholarship.org/uc/item/5cd7h4kt
Papers,The pragmatics of negation across contexts,https://escholarship.org/uc/item/401783vw
Papers,Implementation of selective attention in sequential word production,https://escholarship.org/uc/item/5hk078mx
Papers,Response Dominance Predicts Garden-Path Comprehension: An ERP Study,https://escholarship.org/uc/item/3sf8f66n
Papers,"Support for a Deliberative Failure Account of Base-Rate Neglect: Prompting
Deliberation Increases Base-Rate use",https://escholarship.org/uc/item/638103cp
Papers,Agency concepts across cultures: How intuitive is folkpsychology?,https://escholarship.org/uc/item/97r007bg
Papers,A Comparison of Small Crowd Selection Methods,https://escholarship.org/uc/item/4jq993h3
Papers,Near-misses sting even when they are uncontrollable,https://escholarship.org/uc/item/99x3m02n
Papers,Is statistical learning trainable?,https://escholarship.org/uc/item/93z978wt
Papers,Causal reasoning in a prediction task with hidden causes,https://escholarship.org/uc/item/6209t575
Papers,"Getting From Here to There! : Testing the Effectiveness of an
Interactive Mathematics Intervention Embedding Perceptual Learning",https://escholarship.org/uc/item/4wj428kw
Papers,"You're special, but it doesn't matter if you're a greenhorn: Social recommender strategies for mere mortals",https://escholarship.org/uc/item/7gm7k27n
Papers,Upsetting the contingency table: Causal induction over sequences of point events,https://escholarship.org/uc/item/0cr5s8z1
Papers,Assessing a Bayesian account of human gaze perception,https://escholarship.org/uc/item/47183255
Papers,How Sharing Contexts Influence Purchase Amounts: The Case of Food Choices,https://escholarship.org/uc/item/2f21z0hs
Papers,Memory distortions resulting from a choice blindness task,https://escholarship.org/uc/item/0vr4s1f2
Papers,Active learning as a means to distinguish among prominent decision strategies,https://escholarship.org/uc/item/8gn987jf
Papers,Young Children‚Äôs Self-Directed Information Gathering on Touchscreens,https://escholarship.org/uc/item/5vt5g724
Papers,Learning mode and comparison in relational category learning,https://escholarship.org/uc/item/52q2v3pk
Papers,"Communicative Efficiency and Miscommunication: The Costs and Benefits of
Variable Language Production",https://escholarship.org/uc/item/9kp2r9z9
Papers,"Congenitally Deaf Children Generate Iconic Vocalizations to Communicate
Magnitude",https://escholarship.org/uc/item/1g76m05r
Papers,Iconicity in English Vocabulary and its Relation to Toddlers' Word Learning,https://escholarship.org/uc/item/6536w0w1
Papers,"Anticipatory and Locally Coherent Lexical Activation Varies as a Function of
Language Proficiency",https://escholarship.org/uc/item/1pf4g78m
Papers,Wayfinding and restructuring in a novel city: an insight problem solving task,https://escholarship.org/uc/item/8g9867hw
Papers,"Cognitive architecture and second-order systematicity: categorical
compositionality and a (co)recursion model of systematic learning",https://escholarship.org/uc/item/2g25n2dg
Papers,Computational principles underlying people‚Äôs behavior explanations,https://escholarship.org/uc/item/5pc3r77v
Papers,"Speaker-specific generalization of pragmatic inferences based on prenominal
adjectives",https://escholarship.org/uc/item/4nt0m2z9
Papers,Flexible Use of Phonological and Visual Memory in Language-mediated Visual Search,https://escholarship.org/uc/item/5kc5r7bg
Papers,Mathematical Model of Developmental Changes in Number Cognition,https://escholarship.org/uc/item/5zv3m5kx
Papers,"Shifting Covert Attention to Spatially Indexed Locations Increases Retrieval
Performance of Verbal Information",https://escholarship.org/uc/item/29n3t8n0
Papers,Attacker and Defender Counting Approach for Abstract Argumentation,https://escholarship.org/uc/item/0r80h6vf
Papers,Learning Additive and Substitutive Features,https://escholarship.org/uc/item/44n5b28f
Papers,"Why Do Readers Answer Questions Incorrectly
After Reading Garden-path Sentences?",https://escholarship.org/uc/item/0j78g2bj
Papers,Lateral Inhibition Overcomes Limits of Temporal Difference Learning,https://escholarship.org/uc/item/2zj747vd
Papers,"Preferred Inferences in Causal Relational Reasoning:
Counting Model Operations",https://escholarship.org/uc/item/2jv8f9tp
Papers,"Generating Hyperdimensional Distributed Representations from Continuous-
Valued Multivariate Sensory Input",https://escholarship.org/uc/item/3db1b0x6
Papers,Cross-situational cues are relevant for early word segmentation,https://escholarship.org/uc/item/336868mc
Papers,"Computational evidence for effects of memory decay, familiarity preference and
mutual exclusivity in cross-situational learning",https://escholarship.org/uc/item/9pv6j7t5
Papers,Cognitive Consequences of Interactivity,https://escholarship.org/uc/item/5d49q6qn
Papers,"Eye Movements Reveal Sensitivity to Sound Symbolism
Early and Late in Word Learning",https://escholarship.org/uc/item/0f8094k3
Papers,The Attentional Learning Trap and How to Avoid It,https://escholarship.org/uc/item/5sc236bz
Papers,What defines a category? Evidence that listeners' perception is governed by generalizations,https://escholarship.org/uc/item/3q57v8m4
Papers,"Transfer Effects of Prompted and Self-Reported
Analogical Comparison and Self-Explanation",https://escholarship.org/uc/item/10w1x6qj
Papers,"How do different training tasks modulate our perception and hemispheric
lateralization in the development of perceptual expertise?",https://escholarship.org/uc/item/75t4v432
Papers,Effects of Complementary Control on the Coordination Dynamics of Joint-Action,https://escholarship.org/uc/item/23p8w0zg
Papers,Development of selective attention in category learning,https://escholarship.org/uc/item/6vr3663s
Papers,"Auditory Stimuli Slow Down Responses and First Fixations:
Support for Auditory Dominance in Adults",https://escholarship.org/uc/item/0nc816wd
Papers,"Capturing Social Motor Coordination: A comparison of the Microsoft Kinect,
Video-Motion Analysis and the Polhemus Latus Motion Tracking System",https://escholarship.org/uc/item/8cv44951
Papers,"Can Joint Action be Synergistic?
Studying the Stabilization of Interpersonal Hand Coordination",https://escholarship.org/uc/item/63t337vg
Papers,Do Markov Violations and Failures of Explaining Away Persist with Experience?,https://escholarship.org/uc/item/51b927w6
Papers,How Causal Mechanism and Autocorrelation Beliefs Influence Information Search,https://escholarship.org/uc/item/0296c6z7
Papers,"Children search for information as efficiently as adults,
but seek additional confirmatory evidence",https://escholarship.org/uc/item/5dv9f52r
Papers,Restoring the Context of Interrupted Work with Desktop Thumbnails,https://escholarship.org/uc/item/1pt4c25g
Papers,"Representing and Learning a Large System of Number Concepts
with Latent Predicate Networks",https://escholarship.org/uc/item/07p69506
Papers,"Helping Students Understand Posterior Probabilities:
Research with a Digital Learning Environment on the Monty Hall Dilemma",https://escholarship.org/uc/item/1268x3sg
Papers,The Moral Rhetoric of Climate Change,https://escholarship.org/uc/item/5tf5x0v9
Papers,Some Probability Judgments may Rely on Complexity Assessments,https://escholarship.org/uc/item/7k59h1g8
Papers,How People Estimate Effect Sizes: The Role of Means and Standard Deviations,https://escholarship.org/uc/item/79v573s0
Papers,"How do children construct the color lexicon? :
Restructuring the domain as a connected system",https://escholarship.org/uc/item/3g41v804
Papers,"Tactile Experience Is Evoked by Visual Image of Materials:
Evidence from Onomatopoeia",https://escholarship.org/uc/item/2qw948pn
Papers,"Highlighting the Causal Meaning of Causal Test Questions
in Contexts of Norm Violations",https://escholarship.org/uc/item/3cd7747p
Papers,"The influence of hand or foot responses on response times in investigating action
sentence processing",https://escholarship.org/uc/item/5hr2p53j
Papers,"Gaze is not Enough: Computational Analysis of Infant's Head
Movement Measures the Developing Response to Social Interaction",https://escholarship.org/uc/item/1mp0f2cb
Papers,Large-scale investigations of variability in children‚Äôs first words,https://escholarship.org/uc/item/7q40d9ws
Papers,Assessing the Perceived Predictability of Functions,https://escholarship.org/uc/item/0w17n1rw
Papers,Learning and decisions in contextual multi-armed bandit tasks,https://escholarship.org/uc/item/0s78h2p2
Papers,Motion perception of biological swarms,https://escholarship.org/uc/item/2mj4z5kh
Papers,"The role of conflict in the n-2 repetition cost in task switching:
a computational model",https://escholarship.org/uc/item/891852r7
Papers,Neuronal Dynamics and Spatial Foraging,https://escholarship.org/uc/item/29d6d91t
Papers,Examining the role of inhibitory control in bilingual language switching,https://escholarship.org/uc/item/8d17q7nn
Papers,"Deliberate Practice Revisited: Complexity and Creativity in the Practice Process in
Breakdance",https://escholarship.org/uc/item/0r13s296
Papers,"The Dynamics of Spoken Word Recognition in Second Language Listeners
Reveal Native-Like Lexical Processing",https://escholarship.org/uc/item/43r657vc
Papers,Learning a Center-Embeddding Rule in an Artificial Grammar Learning Task,https://escholarship.org/uc/item/0px532p8
Papers,Modelling Causal Reasoning under Ambiguity,https://escholarship.org/uc/item/24x7681k
Papers,Moral Reasoning as Probability Reasoning,https://escholarship.org/uc/item/5gn4v1fm
Papers,"Predicting Meme Success with Linguistic Features in a Multilayer
Backpropagation Network",https://escholarship.org/uc/item/9c34s7mh
Papers,"Tetris¬ó: Exploring Human Performance via Cross Entropy
Reinforcement Learning Models",https://escholarship.org/uc/item/01w2w060
Papers,Children Learn Better When They Select Their Own Data,https://escholarship.org/uc/item/2km363bs
Papers,"Toddlers Learn with Facilitated Play, Not Free Play",https://escholarship.org/uc/item/93v5g359
Papers,"Memory Capacity Limits in Processing of Natural Connected Speech:
The Psychological Reality of Intonation Units",https://escholarship.org/uc/item/8v18c50x
Papers,"Attention and Pattern Consciousness Reorganize the Cortical Topography of Event-
Related Potential Correlates of Visual Sequential Learning.",https://escholarship.org/uc/item/6j15m001
Papers,Statistical and Chunking Processes in Adults' Visual Sequence Learning,https://escholarship.org/uc/item/3f46z1dp
Papers,"Understanding Deverbal Nominals:
World Knowledge or Lexical Semantics?",https://escholarship.org/uc/item/0cr9b8vn
Papers,Prospective uncertainty: The range of possible futures in physical predictions,https://escholarship.org/uc/item/7mb5p73k
Papers,Let's Get Physical: Thinking with Things in Architectural Design,https://escholarship.org/uc/item/6d52231n
Papers,Reading and writing direction effects on the aesthetic perception of photographs,https://escholarship.org/uc/item/8zh8t8jk
Papers,Multiple Language Gender Identification for Blog Posts,https://escholarship.org/uc/item/66d4z61k
Papers,Elemental Causal Learning from Transitions,https://escholarship.org/uc/item/1wx2047x
Papers,"Exploring the processing costs of the exactly and at least readings of bare numerals
with event-related brain potentials",https://escholarship.org/uc/item/0577n6rz
Papers,Attention dynamics in multiple object tracking,https://escholarship.org/uc/item/4ss6w1r5
Papers,"Choosing fast and slow: explaining differences between hedonic and utilitarian
choices",https://escholarship.org/uc/item/4md2d5pt
Papers,"Watch out! - An instruction raising students‚Äô epistemic vigilance augments their
sourcing activities",https://escholarship.org/uc/item/16v1k8dd
Papers,Social Situation Awareness: Empathic Accuracy in the Aircraft Cockpit,https://escholarship.org/uc/item/9vx8755r
Papers,Human behavior in contextual multi-armed bandit problems,https://escholarship.org/uc/item/53x415cj
Papers,Toddlers Always Get the Last Word: Recency biases in early verbal behavior,https://escholarship.org/uc/item/6g27r8s2
Papers,Generating Functions in Neural Learning of Sequential Structures,https://escholarship.org/uc/item/8xz1v34k
Papers,"How learners use feedback information:
Effects of social comparative information and achievement goals",https://escholarship.org/uc/item/0g30r3r8
Papers,Inhibition Failure is Mediated by a Disposition Toward Flexible Thinking,https://escholarship.org/uc/item/2h49c8rs
Papers,"M3-Situating Embodied Learning: Embedding Gestures in Narratives to learn
Mathematical FrActions in a digital tablet environment",https://escholarship.org/uc/item/2p69d9qs
Papers,Memory Foraging in a Spatial Domain,https://escholarship.org/uc/item/8zj8h7tf
Papers,"Formation of an art concept:
A case study using quantitative analysis of a contemporary artist‚Äôs interview data",https://escholarship.org/uc/item/8pc2j153
