Type,Title,Link
Papers,Memory Processes of Sequential Action Selection,https://escholarship.org/uc/item/32m336mb
Papers,The Effects of Criticism on Creative Ideation,https://escholarship.org/uc/item/80x62763
Papers,"Adaptive Perceptual Learning in Electrocardiography:
The Synergy of Passive and Active Classification",https://escholarship.org/uc/item/1vh9w02k
Papers,"Improving Lexical Memory Access and Decision Making Processes Using
Cognitive Word Games",https://escholarship.org/uc/item/6pj47967
Papers,Systemic Metaphors Promote Systems Thinking,https://escholarship.org/uc/item/38f266dx
Papers,Comparing Metaphors Reveals their Persuasive Capacity,https://escholarship.org/uc/item/54t6f5d8
Papers,"Metaphors Affect Reasoning:
Measuring Effects of Metaphor in a Dynamic Opinion Landscape",https://escholarship.org/uc/item/34m4k59j
Papers,"The perception and memory of object properties: The role of attention, intention,
and information detection",https://escholarship.org/uc/item/1x52q26f
Papers,An Account of Associative Learning in Memory Recall,https://escholarship.org/uc/item/40b5v87q
Papers,Representations of Time Affect Willingness to Wait for Future Rewards,https://escholarship.org/uc/item/115087zp
Papers,Building the mental timeline: Spatial representations of time in preschoolers,https://escholarship.org/uc/item/816936t4
Papers,How Sharp is Occam's Razor? Language Statistics in Cognitive Processing,https://escholarship.org/uc/item/6p22z7fj
Papers,Addressee Backchannels Can Bias Third-Party Memory and Judgment,https://escholarship.org/uc/item/5sr418q1
Papers,"What drives ""Unconscious"" Multi-Attribute Decision-Making?",https://escholarship.org/uc/item/4hq6m1vj
Papers,ERP indices of situated reference in visual contexts,https://escholarship.org/uc/item/8pv52647
Papers,Childhood SES affects anticipatory language comprehension in college-aged adults,https://escholarship.org/uc/item/1kg9z33w
Papers,Constraints on Hypothesis Selection in Causal Learning,https://escholarship.org/uc/item/3hj590td
Papers,"Social Eye Cue:
How Knowledge Of Another Person‚Äôs Attention Changes Your Own",https://escholarship.org/uc/item/5c63r4b1
Papers,"Constructing meaning:
Material products of a creative activity engage the social brain",https://escholarship.org/uc/item/4q00x5dh
Papers,"Why Stickiness is not Enough to Explain Persistence of Counterintuitive Religious
Concepts",https://escholarship.org/uc/item/21v136d0
Papers,Insight and Cognitive Ecosystems,https://escholarship.org/uc/item/3991f2vx
Papers,Predicting Lexical Norms Using a Word Association Corpus,https://escholarship.org/uc/item/26h3m3m6
Papers,Goals Affect the Perceived Quality of Explanations,https://escholarship.org/uc/item/4st4h0hx
Papers,"Explanations and Causal Judgments are Differentially Sensitive to Covariation and
Mechanism Information",https://escholarship.org/uc/item/1bz8c5x6
Papers,"Emergence of systematic iconicity: transmission, interaction and analogy",https://escholarship.org/uc/item/8rn5p4hm
Papers,"Manipulating the Contents of Consciousness
A Mechanistic-Manipulationist Perspective on Content-NCC Research",https://escholarship.org/uc/item/29p122m4
Papers,Spatial Perception is Continuously Constrained by Goals and Memories,https://escholarship.org/uc/item/7ph1k1pk
Papers,Processing Overt and Null Subject Pronouns in Italian: a Cognitive Model,https://escholarship.org/uc/item/02c9x6jf
Papers,Individual Belief Revision Dynamics in a Group Context,https://escholarship.org/uc/item/2mg8w82j
Papers,"Pattern Probabilities for Non-Dichotomous Events:
A New Rational Contribution to the Conjunction Fallacy Debate",https://escholarship.org/uc/item/16n762gr
Papers,The Tragedy of Inner-Individual Dilemmas,https://escholarship.org/uc/item/9sb552s3
Papers,Verbal Synchrony in Large Groups,https://escholarship.org/uc/item/5gk896jg
Papers,Executive Functions and Conceptual Change in Science and Mathematics Learning,https://escholarship.org/uc/item/4036468r
Papers,Cross-Cultural Comparison of Peer Influence on Discovery Rate during Play,https://escholarship.org/uc/item/6jk4t0q1
Papers,Why is Number Word Learning Hard? Evidence from Bilingual Learners,https://escholarship.org/uc/item/26f5d8ts
Papers,"The ""Fundamental Attribution Error"" is rational in an uncertain world",https://escholarship.org/uc/item/48d9b5qb
Papers,The role of working memory in melodic perception,https://escholarship.org/uc/item/3q78p6st
Papers,"The early emergence and puzzling decline of relational reasoning: Effects of prior knowledge and search on inferring ""same"" and ""different""",https://escholarship.org/uc/item/1dn6r2rq
Papers,Disambiguation Across the Senses: The Role of Discovery-Based Interference,https://escholarship.org/uc/item/4831c81m
Papers,Confidence Judgments and Eye Fixations Reveal Adults‚Äô Fractions Knowledge,https://escholarship.org/uc/item/8sr775qp
Papers,"Infant Locomotion, the Language Environment, and Language Development:
A Home Observation Study",https://escholarship.org/uc/item/9m0219bb
Papers,"Power-law fluctuations in eye movements predict text comprehension during
connected text reading",https://escholarship.org/uc/item/6dx236wv
Papers,Verbal Reports Reveal Strategies in Multiple-Cue Probabilistic Inference,https://escholarship.org/uc/item/8f5340zk
Papers,"Musical improvisation:
Multi-scaled spatiotemporal patterns of coordination",https://escholarship.org/uc/item/7xx3d0md
Papers,"Modeling the Object Recognition Pathway: A Deep Hierarchical Model Using
Gnostic Fields",https://escholarship.org/uc/item/8t67g683
Papers,"Statistical Structures in Artificial languages Prime Relative Clause Attachment
Biases in English",https://escholarship.org/uc/item/0f6289dd
Papers,"Characterizing the Difference between Learning about Adjacent
and Non-adjacent Dependencies",https://escholarship.org/uc/item/3bn9d644
Papers,"Interpersonal Anticipatory Synchronization:
The Facilitating Role of Short Visual-Motor Feedback Delays",https://escholarship.org/uc/item/2069h726
Papers,Reasoning about sentience and animacy: Children's and adults' inferences about the properties of unseen entities,https://escholarship.org/uc/item/7d58f4z5
Papers,A Computational Model for Learning Structured Concepts From Physical Scenes,https://escholarship.org/uc/item/8690592r
Papers,Reducing overconfidence in forecasting with repeated judgement elicitation,https://escholarship.org/uc/item/0nq276b9
Papers,Using Ground Truths to Improve Wisdom of the Crowd Estimates,https://escholarship.org/uc/item/8dv3221t
Papers,"When killing the heavy man seems right
Making people utilitarian by simply adding options to moral dilemmas",https://escholarship.org/uc/item/13b796v3
Papers,Transitivity is Not Obvious: Probing Prerequisites for Learning,https://escholarship.org/uc/item/5vm450cr
Papers,"We Readily Anchor Upon Others, But it is Easier to Anchor on the Self",https://escholarship.org/uc/item/3gn1016t
Papers,A Domain-Independent Model of Open-World Reference Resolution,https://escholarship.org/uc/item/6f17r533
Papers,Visuo-spatial Working Memory and the Comprehension of Iconic Gestures,https://escholarship.org/uc/item/20d0b3hf
Papers,Contingent Labeling after Infants' Pointing Helps Infants Learn Words,https://escholarship.org/uc/item/01j6405g
Papers,"A fine-grained understanding of emotions: Young children match within-valence
emotional expressions to their causes",https://escholarship.org/uc/item/3sv1179j
Papers,"Assessing Masked Semantic Priming: Cursor Trajectory versus Response Time
Measures",https://escholarship.org/uc/item/4809g6ns
Papers,General Language Ability Predicts Talker Identification,https://escholarship.org/uc/item/17d1t53h
Papers,A Computational Evaluation of Two Laws of Semantic Change,https://escholarship.org/uc/item/6301h6rd
Papers,Semantic chaining and efficient communication: The case of container names,https://escholarship.org/uc/item/5180p3q0
Papers,An adaptive cue combination model of spatial reorientation,https://escholarship.org/uc/item/5rk115mg
Papers,Assessing Emotions by Cursor Motions: An Affective Computing Approach,https://escholarship.org/uc/item/9vf4s0vp
Papers,"Learning of Time Varying Functions is Based on Association Between Successive
Stimuli",https://escholarship.org/uc/item/99m4825w
Papers,Towards an Empirical test of Realism in Cognition,https://escholarship.org/uc/item/23m8f70t
Papers,Diagnosticity: Some theoretical and empirical progress,https://escholarship.org/uc/item/0h1029t1
Papers,Learning of bimodally distributed quantities,https://escholarship.org/uc/item/9sc6x29w
Papers,"Efficient analysis-by-synthesis in vision: A computational framework, behavioral
tests, and comparison with neural representations",https://escholarship.org/uc/item/10j5s56s
Papers,Children‚Äôs Online Processing of Ad-Hoc Implicatures,https://escholarship.org/uc/item/8tt474w6
Papers,"Linking Joint Attention with Hand-Eye Coordination ‚Äì A Sensorimotor Approach to
Understanding Child-Parent Social Interaction",https://escholarship.org/uc/item/4bg2k1x1
Papers,Understanding young children's imitative behavior from an individual differences perspective,https://escholarship.org/uc/item/3mc8x48g
Papers,"Signatures of Domain-General Categorization Mechanisms
in ColorWord Learning",https://escholarship.org/uc/item/0tf3r6kh
Papers,"Rethinking the Conceptual History of the Term ""Cognitive""",https://escholarship.org/uc/item/06p6s8qj
Papers,Consistency in Brain Activation Predicts Success in Transfer,https://escholarship.org/uc/item/2br8j0qf
Papers,"Statistical Word Learning is a Continuous Process: Evidence from the Human
Simulation Paradigm",https://escholarship.org/uc/item/7266d8rq
Papers,No One Left Behind: How Social Distance Affects Life-Saving Decision Making,https://escholarship.org/uc/item/3dw5b7t2
Papers,"A Bayesian hierarchical model of local-global processing: visual crowding
as a case-study",https://escholarship.org/uc/item/98m8569z
Papers,In Search of Triggering Conditions for Spontaneous Visual Perspective Taking,https://escholarship.org/uc/item/7ts6j98x
Papers,The Impact of Granularity on Worked Examples and Problem Solving,https://escholarship.org/uc/item/7wm3v28k
Papers,"More Than a Blood Pump: An Experimental Enquiry of the Folk Theory of the
Heart",https://escholarship.org/uc/item/52n5n0gw
Papers,"You say potato, I say tŭdòu: How speakers of different languages share the same concept",https://escholarship.org/uc/item/7sb4555q
